{
 "archetype": "service",
 "company": "成都启元财税服务有限公司",
 "dept": "作业部",
 "today": "2026-09-17",
 "weekStart": "2026-09-14",
 "erpKey": "service",
 "sources": [
  {
   "id": "route",
   "name": "工艺路线与标准工时",
   "mode": "direct",
   "lastSync": "2026-09-17 07:30",
   "rows": 14
  },
  {
   "id": "report",
   "name": "工时记录",
   "mode": "direct",
   "lastSync": "2026-09-17 12:00",
   "rows": 23
  },
  {
   "id": "machine",
   "name": "系统运行记录",
   "mode": "import",
   "lastSync": "2026-09-17 07:00",
   "rows": 4
  },
  {
   "id": "roster",
   "name": "班组排班",
   "mode": "import",
   "lastSync": "2026-09-16 18:00",
   "rows": 20
  }
 ],
 "constraintExpected": "G2",
 "spareLine": "G2",
 "releaseLine": "G1",
 "supportIds": [
  "E-026",
  "E-027"
 ],
 "spcMachine": "SYS-02",
 "dueMachine": "SYS-02",
 "shiftHours": 8,
 "otCap": {
  "month": 36,
  "day": 3
 },
 "buffers": {
  "G2": {
   "capDays": 1.5
  }
 },
 "fixtures": {
  "V01": {
   "fixture": "小规模模板",
   "program": "资料包 S"
  },
  "V02": {
   "fixture": "一般纳税人模板",
   "program": "资料包 G"
  },
  "V03": {
   "fixture": "一般纳税人模板",
   "program": "资料包 Y"
  }
 },
 "setupMatrix": {
  "sameProduct": 5,
  "sameFixture": 15,
  "diffFixture": 30
 },
 "setupSteps": [
  {
   "name": "账套切换与核对",
   "min": 4,
   "internal": true
  },
  {
   "name": "模板加载",
   "min": 6,
   "internal": true
  },
  {
   "name": "首户复核",
   "min": 6,
   "internal": true
  },
  {
   "name": "下户资料包预整理",
   "min": 8,
   "internal": false
  },
  {
   "name": "常用科目与模板预设",
   "min": 5,
   "internal": false
  }
 ],
 "firstPieceItems": [
  "资料包完整",
  "模板版本核对",
  "首户复核",
  "异常科目标记",
  "首户签字"
 ],
 "spare": {
  "line": "G2",
  "capPerPerson": 1.6,
  "effTo": 1,
  "defaultSupport": 2
 },
 "lunchH": 0.5,
 "firstPieceMinPerSetup": 6,
 "employees": [
  {
   "id": "E-001",
   "job": "acct-agent",
   "overtimeH": 36
  },
  {
   "id": "E-002",
   "job": "acct-agent",
   "overtimeH": 39
  },
  {
   "id": "E-003",
   "job": "acct-agent",
   "overtimeH": 42
  },
  {
   "id": "E-004",
   "job": "acct-agent",
   "overtimeH": 45
  },
  {
   "id": "E-005",
   "job": "acct-agent",
   "overtimeH": 48
  },
  {
   "id": "E-006",
   "job": "acct-agent",
   "overtimeH": 51
  },
  {
   "id": "E-007",
   "job": "acct-agent",
   "overtimeH": 54
  },
  {
   "id": "E-008",
   "job": "acct-agent",
   "overtimeH": 57
  },
  {
   "id": "E-009",
   "job": "acct-agent",
   "overtimeH": 60
  },
  {
   "id": "E-010",
   "job": "acct-agent",
   "overtimeH": 63
  },
  {
   "id": "E-011",
   "job": "acct-agent",
   "overtimeH": 5
  },
  {
   "id": "E-012",
   "job": "acct-agent",
   "overtimeH": 0
  },
  {
   "id": "E-013",
   "job": "acct-agent",
   "overtimeH": 2
  },
  {
   "id": "E-014",
   "job": "acct-agent",
   "overtimeH": 3
  },
  {
   "id": "E-015",
   "job": "acct-agent",
   "overtimeH": 1
  },
  {
   "id": "E-016",
   "job": "acct-agent",
   "overtimeH": 7
  },
  {
   "id": "E-017",
   "job": "acct-agent",
   "overtimeH": 1
  },
  {
   "id": "E-018",
   "job": "acct-agent",
   "overtimeH": 1
  },
  {
   "id": "E-019",
   "job": "acct-agent",
   "overtimeH": 3
  },
  {
   "id": "E-020",
   "job": "acct-agent",
   "overtimeH": 6
  },
  {
   "id": "E-021",
   "job": "acct-agent",
   "overtimeH": 8
  },
  {
   "id": "E-022",
   "job": "acct-agent",
   "overtimeH": 4
  },
  {
   "id": "E-023",
   "job": "acct-agent",
   "overtimeH": 8
  },
  {
   "id": "E-024",
   "job": "acct-agent",
   "overtimeH": 4
  },
  {
   "id": "E-025",
   "job": "tax-consult",
   "overtimeH": 7
  },
  {
   "id": "E-026",
   "job": "tax-consult",
   "overtimeH": 1
  },
  {
   "id": "E-027",
   "job": "tax-consult",
   "overtimeH": 1
  },
  {
   "id": "E-028",
   "job": "tax-consult",
   "overtimeH": 4
  },
  {
   "id": "E-029",
   "job": "tax-consult",
   "overtimeH": 2
  },
  {
   "id": "E-030",
   "job": "cust-mgr",
   "overtimeH": 6
  },
  {
   "id": "E-031",
   "job": "cust-mgr",
   "overtimeH": 7
  },
  {
   "id": "E-032",
   "job": "cust-mgr",
   "overtimeH": 4
  },
  {
   "id": "E-033",
   "job": "cust-mgr",
   "overtimeH": 6
  },
  {
   "id": "E-034",
   "job": "cust-mgr",
   "overtimeH": 5
  },
  {
   "id": "E-035",
   "job": "cust-mgr",
   "overtimeH": 8
  },
  {
   "id": "E-036",
   "job": "cust-mgr",
   "overtimeH": 8
  }
 ],
 "skills": [
  {
   "emp": "E-001",
   "home": "G2",
   "levels": {
    "资料收集": 0,
    "凭证录入": 3,
    "账务处理": 2,
    "申报": 0,
    "归档": 0
   }
  },
  {
   "emp": "E-002",
   "home": "G3",
   "levels": {
    "资料收集": 0,
    "凭证录入": 3,
    "账务处理": 3,
    "申报": 0,
    "归档": 0
   }
  },
  {
   "emp": "E-003",
   "home": "G2",
   "levels": {
    "资料收集": 0,
    "凭证录入": 2,
    "账务处理": 2,
    "申报": 0,
    "归档": 0
   }
  },
  {
   "emp": "E-004",
   "home": "G3",
   "levels": {
    "资料收集": 0,
    "凭证录入": 2,
    "账务处理": 1,
    "申报": 0,
    "归档": 0
   }
  },
  {
   "emp": "E-005",
   "home": "G2",
   "levels": {
    "资料收集": 0,
    "凭证录入": 3,
    "账务处理": 0,
    "申报": 0,
    "归档": 0
   }
  },
  {
   "emp": "E-006",
   "home": "G3",
   "levels": {
    "资料收集": 0,
    "凭证录入": 3,
    "账务处理": 0,
    "申报": 0,
    "归档": 0
   }
  },
  {
   "emp": "E-007",
   "home": "G2",
   "levels": {
    "资料收集": 0,
    "凭证录入": 2,
    "账务处理": 0,
    "申报": 0,
    "归档": 0
   }
  },
  {
   "emp": "E-008",
   "home": "G3",
   "levels": {
    "资料收集": 0,
    "凭证录入": 1,
    "账务处理": 2,
    "申报": 0,
    "归档": 0
   }
  },
  {
   "emp": "E-009",
   "home": "G2",
   "levels": {
    "资料收集": 0,
    "凭证录入": 2,
    "账务处理": 2,
    "申报": 0,
    "归档": 0
   }
  },
  {
   "emp": "E-010",
   "home": "G3",
   "levels": {
    "资料收集": 0,
    "凭证录入": 3,
    "账务处理": 3,
    "申报": 0,
    "归档": 0
   }
  },
  {
   "emp": "E-011",
   "home": "G2",
   "levels": {
    "资料收集": 0,
    "凭证录入": 3,
    "账务处理": 3,
    "申报": 0,
    "归档": 0
   }
  },
  {
   "emp": "E-012",
   "home": "G3",
   "levels": {
    "资料收集": 0,
    "凭证录入": 3,
    "账务处理": 2,
    "申报": 0,
    "归档": 0
   }
  },
  {
   "emp": "E-013",
   "home": "G2",
   "levels": {
    "资料收集": 0,
    "凭证录入": 3,
    "账务处理": 0,
    "申报": 0,
    "归档": 0
   }
  },
  {
   "emp": "E-014",
   "home": "G3",
   "levels": {
    "资料收集": 0,
    "凭证录入": 2,
    "账务处理": 1,
    "申报": 0,
    "归档": 0
   }
  },
  {
   "emp": "E-015",
   "home": "G2",
   "levels": {
    "资料收集": 0,
    "凭证录入": 3,
    "账务处理": 3,
    "申报": 0,
    "归档": 0
   }
  },
  {
   "emp": "E-016",
   "home": "G3",
   "levels": {
    "资料收集": 0,
    "凭证录入": 3,
    "账务处理": 3,
    "申报": 0,
    "归档": 0
   }
  },
  {
   "emp": "E-017",
   "home": "G2",
   "levels": {
    "资料收集": 0,
    "凭证录入": 3,
    "账务处理": 3,
    "申报": 0,
    "归档": 0
   }
  },
  {
   "emp": "E-018",
   "home": "G3",
   "levels": {
    "资料收集": 0,
    "凭证录入": 2,
    "账务处理": 3,
    "申报": 0,
    "归档": 0
   }
  },
  {
   "emp": "E-019",
   "home": "G2",
   "levels": {
    "资料收集": 0,
    "凭证录入": 2,
    "账务处理": 3,
    "申报": 0,
    "归档": 0
   }
  },
  {
   "emp": "E-020",
   "home": "G3",
   "levels": {
    "资料收集": 0,
    "凭证录入": 3,
    "账务处理": 3,
    "申报": 0,
    "归档": 0
   }
  },
  {
   "emp": "E-021",
   "home": "G2",
   "levels": {
    "资料收集": 0,
    "凭证录入": 1,
    "账务处理": 1,
    "申报": 0,
    "归档": 0
   }
  },
  {
   "emp": "E-022",
   "home": "G3",
   "levels": {
    "资料收集": 0,
    "凭证录入": 2,
    "账务处理": 0,
    "申报": 0,
    "归档": 0
   }
  },
  {
   "emp": "E-023",
   "home": "G2",
   "levels": {
    "资料收集": 0,
    "凭证录入": 1,
    "账务处理": 1,
    "申报": 0,
    "归档": 0
   }
  },
  {
   "emp": "E-024",
   "home": "G3",
   "levels": {
    "资料收集": 0,
    "凭证录入": 3,
    "账务处理": 3,
    "申报": 0,
    "归档": 0
   }
  },
  {
   "emp": "E-025",
   "home": "G4",
   "levels": {
    "资料收集": 0,
    "凭证录入": 0,
    "账务处理": 0,
    "申报": 3,
    "归档": 0
   }
  },
  {
   "emp": "E-026",
   "home": "G4",
   "levels": {
    "资料收集": 0,
    "凭证录入": 2,
    "账务处理": 2,
    "申报": 3,
    "归档": 3
   }
  },
  {
   "emp": "E-027",
   "home": "G4",
   "levels": {
    "资料收集": 0,
    "凭证录入": 2,
    "账务处理": 2,
    "申报": 3,
    "归档": 3
   }
  },
  {
   "emp": "E-028",
   "home": "G4",
   "levels": {
    "资料收集": 0,
    "凭证录入": 2,
    "账务处理": 2,
    "申报": 1,
    "归档": 1
   }
  },
  {
   "emp": "E-029",
   "home": "G4",
   "levels": {
    "资料收集": 0,
    "凭证录入": 2,
    "账务处理": 2,
    "申报": 3,
    "归档": 1
   }
  },
  {
   "emp": "E-030",
   "home": "G1",
   "levels": {
    "资料收集": 1,
    "凭证录入": 0,
    "账务处理": 0,
    "申报": 0,
    "归档": 0
   }
  },
  {
   "emp": "E-031",
   "home": "G1",
   "levels": {
    "资料收集": 3,
    "凭证录入": 0,
    "账务处理": 0,
    "申报": 0,
    "归档": 0
   }
  },
  {
   "emp": "E-032",
   "home": "G1",
   "levels": {
    "资料收集": 2,
    "凭证录入": 0,
    "账务处理": 0,
    "申报": 0,
    "归档": 0
   }
  },
  {
   "emp": "E-033",
   "home": "G1",
   "levels": {
    "资料收集": 3,
    "凭证录入": 0,
    "账务处理": 0,
    "申报": 0,
    "归档": 0
   }
  },
  {
   "emp": "E-034",
   "home": "G1",
   "levels": {
    "资料收集": 2,
    "凭证录入": 0,
    "账务处理": 0,
    "申报": 0,
    "归档": 0
   }
  },
  {
   "emp": "E-035",
   "home": "G1",
   "levels": {
    "资料收集": 3,
    "凭证录入": 0,
    "账务处理": 0,
    "申报": 0,
    "归档": 0
   }
  },
  {
   "emp": "E-036",
   "home": "G1",
   "levels": {
    "资料收集": 3,
    "凭证录入": 0,
    "账务处理": 0,
    "申报": 0,
    "归档": 0
   }
  }
 ],
 "empStats": [
  {
   "emp": "E-001",
   "op": "凭证录入",
   "n": 33,
   "effMed": 1.01
  },
  {
   "emp": "E-001",
   "op": "账务处理",
   "n": 13,
   "effMed": 0.92
  },
  {
   "emp": "E-002",
   "op": "凭证录入",
   "n": 34,
   "effMed": 1.03
  },
  {
   "emp": "E-002",
   "op": "账务处理",
   "n": 17,
   "effMed": 1.01
  },
  {
   "emp": "E-003",
   "op": "凭证录入",
   "n": 13,
   "effMed": 0.87
  },
  {
   "emp": "E-003",
   "op": "账务处理",
   "n": 12,
   "effMed": 0.87
  },
  {
   "emp": "E-004",
   "op": "凭证录入",
   "n": 13,
   "effMed": 0.91
  },
  {
   "emp": "E-004",
   "op": "账务处理",
   "n": 3,
   "effMed": 0.66
  },
  {
   "emp": "E-005",
   "op": "凭证录入",
   "n": 15,
   "effMed": 0.97
  },
  {
   "emp": "E-006",
   "op": "凭证录入",
   "n": 22,
   "effMed": 0.98
  },
  {
   "emp": "E-007",
   "op": "凭证录入",
   "n": 9,
   "effMed": 0.9
  },
  {
   "emp": "E-008",